{
  "schema_version": "1.0",
  "result_id": "cmdres_pause_buy_20260904_041",
  "request_id": "req_efefefefefefefefefefefefefefefef",
  "command_id": "cmd_pause_buy_20260904_041",
  "command_seq": 41,
  "node_id": "node-shanghai-001",
  "account_id": "acct_primary_001",
  "received_at": "2026-09-04T14:45:10+08:00",
  "completed_at": "2026-09-04T14:45:10.125000+08:00",
  "status": "APPLIED",
  "retryable": false,
  "reason_code": "CENTRAL_RISK_PAUSE",
  "previous_state": "AUTO",
  "resulting_state": "PAUSE_BUY"
}
